{
  "active": true,
  "colour": "emerald green",
  "currency": "ZAR",
  "delivery_lead_days": 5,
  "description": "Synthetic demo product.",
  "formality": "SMART_CASUAL",
  "image_attribution": "Original vector illustration generated by scripts/seed_catalogue.py in this repository. No third-party material.",
  "image_licence": "PROJECT_ORIGINAL_ARTWORK_LICENCE_PENDING_OWNER",
  "image_url": "/catalogue/prd_example_dress.svg",
  "material": "linen",
  "merchant_id": "mer_example",
  "name": "Example Midi Wrap Dress",
  "part_type": "DRESS_OR_SUIT",
  "price_cents": 129900,
  "product_id": "prd_example_dress",
  "schema_version": "1.0.0",
  "source_type": "SYNTHETIC_DEMO",
  "style_tags": [
    "midi",
    "wrap",
    "breathable"
  ],
  "variants": [
    {
      "size": "M",
      "stock_quantity": 4,
      "variant_id": "var_example_dress_m"
    }
  ]
}
